{
  "id": "100",
  "key": "tusk",
  "sourceKey": "npc_dota_hero_tusk",
  "name": "Tusk",
  "aliases": [
    "Tusk",
    "Tuskarr",
    "Ymir",
    "npc_dota_hero_tusk",
    "tusk",
    "ymir"
  ],
  "primaryAttribute": 0,
  "attackRange": 150,
  "complexity": 1,
  "roles": [
    {
      "role": "initiator",
      "level": 2
    },
    {
      "role": "disabler",
      "level": 2
    },
    {
      "role": "nuker",
      "level": 1
    }
  ],
  "enabled": true,
  "cmEnabled": true,
  "abilityIds": [
    "ability:100:tusk_ice_shards",
    "ability:100:tusk_snowball",
    "ability:100:tusk_tag_team",
    "ability:100:tusk_drinking_buddies",
    "ability:100:tusk_walrus_kick",
    "ability:100:tusk_walrus_punch",
    "ability:100:tusk_launch_snowball",
    "ability:100:tusk_bitter_chill",
    "ability:100:special_bonus_unique_tusk_3",
    "ability:100:special_bonus_unique_tusk_7",
    "ability:100:special_bonus_hp_325",
    "ability:100:special_bonus_unique_tusk_2",
    "ability:100:special_bonus_unique_tusk_6",
    "ability:100:special_bonus_unique_tusk",
    "ability:100:special_bonus_unique_tusk_shard_dps",
    "ability:100:special_bonus_unique_tusk_4",
    "ability:100:special_bonus_attributes",
    "ability:100:tusk_ice_shards_stop",
    "ability:100:tusk_frozen_sigil"
  ],
  "effectIds": [
    "effect:tusk_ice_shards:damage:shards-projectile-contact",
    "effect:tusk_ice_shards:modifier:impassable-shard-barrier",
    "effect:tusk_snowball:mobility:targeted-snowball-travel",
    "effect:tusk_snowball:control:snowball-contact-base-stun",
    "effect:tusk_snowball:damage:snowball-contact-base-damage",
    "effect:tusk_snowball:modifier:snowball-passenger-capture",
    "effect:tusk_tag_team:damage:tag-team-attack-bonus",
    "effect:tusk_tag_team:slow:tag-team-brief-hit-slow",
    "effect:tusk_drinking_buddies:displacement:shard-friendly-tag-pull",
    "effect:tusk_drinking_buddies:modifier:shard-tagged-partner-armor-speed",
    "effect:tusk_walrus_kick:displacement:scepter-directional-kick",
    "effect:tusk_walrus_kick:control:scepter-kick-stun",
    "effect:tusk_walrus_kick:damage:scepter-kick-damage",
    "effect:tusk_walrus_kick:slow:scepter-kick-slow",
    "effect:tusk_walrus_punch:modifier:true-strike-critical-punch",
    "effect:tusk_walrus_punch:displacement:walrus-punch-air-launch",
    "effect:tusk_bitter_chill:modifier:nearby-attack-speed-chill"
  ],
  "coverage": {
    "rawDefinitions": "known",
    "mechanics": "partial",
    "reviewedEffects": 17,
    "complete": false,
    "fields": {
      "primaryAttribute": {
        "state": "known"
      },
      "attackRange": {
        "state": "known"
      },
      "complexity": {
        "state": "known"
      },
      "roles": {
        "state": "known"
      }
    }
  }
}
