{
  "id": "87",
  "key": "disruptor",
  "sourceKey": "npc_dota_hero_disruptor",
  "name": "Disruptor",
  "aliases": [
    "disruptor",
    "npc_dota_hero_disruptor",
    "thrall"
  ],
  "primaryAttribute": 2,
  "attackRange": 625,
  "complexity": 2,
  "roles": [
    {
      "role": "support",
      "level": 2
    },
    {
      "role": "disabler",
      "level": 2
    },
    {
      "role": "nuker",
      "level": 1
    },
    {
      "role": "initiator",
      "level": 1
    }
  ],
  "enabled": true,
  "cmEnabled": true,
  "abilityIds": [
    "ability:87:disruptor_thunder_strike",
    "ability:87:disruptor_glimpse",
    "ability:87:disruptor_kinetic_field",
    "ability:87:disruptor_kinetic_fence",
    "ability:87:disruptor_electromagnetic_repulsion",
    "ability:87:disruptor_static_storm",
    "ability:87:special_bonus_movement_speed_20",
    "ability:87:special_bonus_unique_disruptor_consecutive_strike_damage",
    "ability:87:special_bonus_unique_disruptor_9",
    "ability:87:special_bonus_unique_disruptor",
    "ability:87:special_bonus_unique_disruptor_5",
    "ability:87:special_bonus_unique_disruptor_8",
    "ability:87:special_bonus_unique_disruptor_4",
    "ability:87:special_bonus_unique_disruptor_thunder_strike_strikes",
    "ability:87:special_bonus_attributes",
    "ability:87:special_bonus_unique_disruptor_2",
    "ability:87:special_bonus_unique_disruptor_7",
    "ability:87:disruptor_innate_kinetic_circle",
    "ability:87:special_bonus_unique_disruptor_fence_charge"
  ],
  "effectIds": [
    "effect:disruptor_thunder_strike:damage:one-thunder-strike",
    "effect:disruptor_thunder_strike:slow:per-strike-movement-and-attack-slow",
    "effect:disruptor_thunder_strike:vision:ordinary-target-tracking",
    "effect:disruptor_glimpse:displacement:return-to-recorded-location",
    "effect:disruptor_glimpse:damage:distance-dependent-glimpse-damage",
    "effect:disruptor_kinetic_field:modifier:delayed-circular-movement-barrier",
    "effect:disruptor_kinetic_fence:modifier:shard-linear-movement-barrier",
    "effect:disruptor_electromagnetic_repulsion:displacement:damage-threshold-repulsion",
    "effect:disruptor_electromagnetic_repulsion:modifier:intelligence-scaled-repulsion-damage",
    "effect:disruptor_static_storm:control:storm-area-silence",
    "effect:disruptor_static_storm:damage:ramping-storm-damage",
    "effect:disruptor_static_storm:control:scepter-storm-item-mute"
  ],
  "coverage": {
    "rawDefinitions": "known",
    "mechanics": "partial",
    "reviewedEffects": 12,
    "complete": false,
    "fields": {
      "primaryAttribute": {
        "state": "known"
      },
      "attackRange": {
        "state": "known"
      },
      "complexity": {
        "state": "known"
      },
      "roles": {
        "state": "known"
      }
    }
  }
}
