{
  "id": "51",
  "key": "rattletrap",
  "sourceKey": "npc_dota_hero_rattletrap",
  "name": "Clockwerk",
  "aliases": [
    "clockwerk",
    "cw",
    "npc_dota_hero_rattletrap",
    "rattletrap"
  ],
  "primaryAttribute": 0,
  "attackRange": 150,
  "complexity": 2,
  "roles": [
    {
      "role": "initiator",
      "level": 3
    },
    {
      "role": "disabler",
      "level": 2
    },
    {
      "role": "durable",
      "level": 1
    },
    {
      "role": "nuker",
      "level": 1
    }
  ],
  "enabled": true,
  "cmEnabled": true,
  "abilityIds": [
    "ability:51:rattletrap_battery_assault",
    "ability:51:rattletrap_power_cogs",
    "ability:51:rattletrap_rocket_flare",
    "ability:51:rattletrap_overclocking",
    "ability:51:rattletrap_jetpack",
    "ability:51:rattletrap_hookshot",
    "ability:51:rattletrap_armor_power",
    "ability:51:rattletrap_jetpack_toggle",
    "ability:51:special_bonus_mp_regen_150",
    "ability:51:special_bonus_unique_clockwerk_hookshot_damage",
    "ability:51:special_bonus_unique_clockwerk_5",
    "ability:51:special_bonus_unique_clockwerk_3",
    "ability:51:special_bonus_unique_clockwerk_4",
    "ability:51:special_bonus_unique_clockwerk_2",
    "ability:51:special_bonus_unique_clockwerk_rocket_flare_charges",
    "ability:51:special_bonus_unique_clockwerk",
    "ability:51:special_bonus_attributes"
  ],
  "effectIds": [
    "effect:rattletrap_battery_assault:damage:random-shrapnel-hit",
    "effect:rattletrap_battery_assault:control:shrapnel-mini-stun",
    "effect:rattletrap_power_cogs:displacement:outside-cog-shock-push",
    "effect:rattletrap_power_cogs:damage:cog-base-shock",
    "effect:rattletrap_power_cogs:modifier:destructible-cog-ring",
    "effect:rattletrap_rocket_flare:damage:global-flare-impact",
    "effect:rattletrap_rocket_flare:slow:global-flare-slow",
    "effect:rattletrap_rocket_flare:vision:global-flare-ordinary-vision",
    "effect:rattletrap_overclocking:modifier:scepter-ability-supercharge",
    "effect:rattletrap_jetpack:mobility:shard-flying-movement",
    "effect:rattletrap_hookshot:mobility:hook-latch-travel",
    "effect:rattletrap_hookshot:control:enemy-hook-stun",
    "effect:rattletrap_hookshot:damage:enemy-hook-damage",
    "effect:rattletrap_armor_power:passive:armor-scaled-damage-and-chainmail-consumption"
  ],
  "coverage": {
    "rawDefinitions": "known",
    "mechanics": "partial",
    "reviewedEffects": 14,
    "complete": false,
    "fields": {
      "primaryAttribute": {
        "state": "known"
      },
      "attackRange": {
        "state": "known"
      },
      "complexity": {
        "state": "known"
      },
      "roles": {
        "state": "known"
      }
    }
  }
}
