{
  "id": "81",
  "key": "chaos_knight",
  "sourceKey": "npc_dota_hero_chaos_knight",
  "name": "Chaos Knight",
  "aliases": [
    "Chaos Knight",
    "Nessaj",
    "chaos-knight",
    "chaos_knight",
    "ck",
    "knight",
    "nessaj",
    "npc_dota_hero_chaos_knight"
  ],
  "primaryAttribute": 0,
  "attackRange": 150,
  "complexity": 1,
  "roles": [
    {
      "role": "carry",
      "level": 3
    },
    {
      "role": "disabler",
      "level": 2
    },
    {
      "role": "durable",
      "level": 2
    },
    {
      "role": "pusher",
      "level": 2
    },
    {
      "role": "initiator",
      "level": 1
    }
  ],
  "enabled": true,
  "cmEnabled": true,
  "abilityIds": [
    "ability:81:chaos_knight_chaos_bolt",
    "ability:81:chaos_knight_reality_rift",
    "ability:81:chaos_knight_chaos_strike",
    "ability:81:generic_hidden",
    "ability:81:chaos_knight_fundamental_forging",
    "ability:81:chaos_knight_phantasm",
    "ability:81:special_bonus_unique_chaos_knight_6",
    "ability:81:special_bonus_unique_chaos_knight_2",
    "ability:81:special_bonus_unique_chaos_knight_8",
    "ability:81:special_bonus_strength_10",
    "ability:81:special_bonus_unique_chaos_knight_3",
    "ability:81:special_bonus_unique_chaos_knight",
    "ability:81:special_bonus_unique_chaos_knight_5",
    "ability:81:special_bonus_unique_chaos_knight_7",
    "ability:81:special_bonus_attributes",
    "ability:81:chaos_knight_phantasmagoria",
    "ability:81:chaos_knight_reins_of_chaos"
  ],
  "effectIds": [
    "effect:chaos_knight_chaos_bolt:control:chaos-bolt-minimum-stun",
    "effect:chaos_knight_chaos_bolt:damage:chaos-bolt-minimum-damage",
    "effect:chaos_knight_chaos_bolt:modifier:shard-bolt-illusion",
    "effect:chaos_knight_reality_rift:displacement:rift-target-and-owned-illusion-reposition",
    "effect:chaos_knight_reality_rift:modifier:rift-armor-reduction",
    "effect:chaos_knight_chaos_strike:modifier:random-chaos-critical-strike",
    "effect:chaos_knight_chaos_strike:heal:chaos-strike-proc-lifesteal",
    "effect:chaos_knight_fundamental_forging:modifier:additional-neutral-enchantment",
    "effect:chaos_knight_phantasm:modifier:phantasm-target-dependent-illusions",
    "effect:chaos_knight_phantasm:dispel:phantasm-basic-self-dispel",
    "effect:chaos_knight_phantasm:save:phantasm-brief-invulnerability",
    "effect:chaos_knight_phantasm:modifier:scepter-probabilistic-and-allied-illusions",
    "effect:chaos_knight_chaos_bolt:illusion:shard-bolt-illusion",
    "effect:chaos_knight_phantasm:illusion:phantasm-target-dependent-illusions",
    "effect:chaos_knight_phantasm:illusion:scepter-probabilistic-and-allied-illusions"
  ],
  "coverage": {
    "rawDefinitions": "known",
    "mechanics": "partial",
    "reviewedEffects": 15,
    "complete": false,
    "fields": {
      "primaryAttribute": {
        "state": "known"
      },
      "attackRange": {
        "state": "known"
      },
      "complexity": {
        "state": "known"
      },
      "roles": {
        "state": "known"
      }
    }
  }
}
