{
  "id": "112",
  "key": "winter_wyvern",
  "sourceKey": "npc_dota_hero_winter_wyvern",
  "name": "Winter Wyvern",
  "aliases": [
    "Auroth",
    "Winter Wyvern",
    "auroth",
    "npc_dota_hero_winter_wyvern",
    "winter-wyvern",
    "winter_wyvern",
    "ww",
    "wyvern"
  ],
  "primaryAttribute": 2,
  "attackRange": 450,
  "complexity": 2,
  "roles": [
    {
      "role": "support",
      "level": 3
    },
    {
      "role": "disabler",
      "level": 2
    },
    {
      "role": "nuker",
      "level": 1
    }
  ],
  "enabled": true,
  "cmEnabled": true,
  "abilityIds": [
    "ability:112:winter_wyvern_arctic_burn",
    "ability:112:winter_wyvern_splinter_blast",
    "ability:112:winter_wyvern_cold_embrace",
    "ability:112:winter_wyvern_eldwurms_edda",
    "ability:112:generic_hidden",
    "ability:112:winter_wyvern_winters_curse",
    "ability:112:special_bonus_unique_winter_wyvern_5",
    "ability:112:special_bonus_attack_damage_30",
    "ability:112:special_bonus_unique_winter_wyvern_6",
    "ability:112:special_bonus_unique_winter_wyvern_2",
    "ability:112:special_bonus_unique_winter_wyvern_1",
    "ability:112:special_bonus_unique_winter_wyvern_7",
    "ability:112:special_bonus_unique_winter_wyvern_3",
    "ability:112:special_bonus_unique_winter_wyvern_4",
    "ability:112:special_bonus_attributes",
    "ability:112:winter_wyvern_eldwurm_scholar",
    "ability:112:winter_wyvern_essence_of_the_blueheart",
    "ability:112:winter_wyvern_dragon_sight",
    "ability:112:winter_wyvern_accelerated_learning"
  ],
  "effectIds": [
    "effect:winter_wyvern_arctic_burn:mobility:arctic-unobstructed-flight",
    "effect:winter_wyvern_arctic_burn:modifier:arctic-attack-reach-and-projectile",
    "effect:winter_wyvern_arctic_burn:damage:arctic-current-health-attack-burn",
    "effect:winter_wyvern_arctic_burn:slow:arctic-attack-movement-slow",
    "effect:winter_wyvern_arctic_burn:modifier:scepter-sustained-arctic-toggle",
    "effect:winter_wyvern_splinter_blast:modifier:splinter-primary-projectile-cast",
    "effect:winter_wyvern_splinter_blast:damage:secondary-splinter-damage",
    "effect:winter_wyvern_splinter_blast:slow:secondary-splinter-movement-slow",
    "effect:winter_wyvern_cold_embrace:save:cold-embrace-physical-immunity",
    "effect:winter_wyvern_cold_embrace:heal:cold-embrace-health-scaled-heal",
    "effect:winter_wyvern_cold_embrace:modifier:shard-emergence-attack-bonus",
    "effect:winter_wyvern_eldwurms_edda:modifier:conditional-edda-consumption-and-ability-progression",
    "effect:winter_wyvern_winters_curse:control:curse-primary-frozen-target",
    "effect:winter_wyvern_winters_curse:control:curse-nearby-forced-attacks",
    "effect:winter_wyvern_winters_curse:modifier:curse-source-qualified-damage-exceptions"
  ],
  "coverage": {
    "rawDefinitions": "known",
    "mechanics": "partial",
    "reviewedEffects": 15,
    "complete": false,
    "fields": {
      "primaryAttribute": {
        "state": "known"
      },
      "attackRange": {
        "state": "known"
      },
      "complexity": {
        "state": "known"
      },
      "roles": {
        "state": "known"
      }
    }
  }
}
