{
  "id": "36",
  "key": "necrolyte",
  "sourceKey": "npc_dota_hero_necrolyte",
  "name": "Necrophos",
  "aliases": [
    "Necrophos",
    "Rotundjere",
    "necrolyte",
    "necrophos",
    "npc_dota_hero_necrolyte",
    "rotundjere"
  ],
  "primaryAttribute": 2,
  "attackRange": 500,
  "complexity": 1,
  "roles": [
    {
      "role": "carry",
      "level": 1
    },
    {
      "role": "nuker",
      "level": 2
    },
    {
      "role": "durable",
      "level": 1
    },
    {
      "role": "disabler",
      "level": 1
    }
  ],
  "enabled": true,
  "cmEnabled": true,
  "abilityIds": [
    "ability:36:necrolyte_death_pulse",
    "ability:36:necrolyte_ghost_shroud",
    "ability:36:necrolyte_heartstopper_aura",
    "ability:36:necrolyte_death_seeker",
    "ability:36:necrolyte_sadist",
    "ability:36:necrolyte_reapers_scythe",
    "ability:36:special_bonus_unique_necrophos_6",
    "ability:36:special_bonus_unique_necrophos_heartstopper_regen_duration",
    "ability:36:special_bonus_unique_necrophos_3",
    "ability:36:special_bonus_unique_necrophos_4",
    "ability:36:special_bonus_spell_aoe_75",
    "ability:36:special_bonus_unique_necrophos_5",
    "ability:36:special_bonus_unique_necrophos_reaper_scythe_damage_per_health",
    "ability:36:special_bonus_unique_necrophos",
    "ability:36:special_bonus_attributes",
    "ability:36:necrolyte_sadist_stop"
  ],
  "effectIds": [
    "effect:necrolyte_death_pulse:damage:pulse",
    "effect:necrolyte_death_pulse:heal:pulse",
    "effect:necrolyte_ghost_shroud:save:self-ethereal",
    "effect:necrolyte_ghost_shroud:slow:aura-movement",
    "effect:necrolyte_ghost_shroud:modifier:self-restoration-amplification",
    "effect:necrolyte_heartstopper_aura:modifier:maximum-health-decay",
    "effect:necrolyte_heartstopper_aura:modifier:scepter-regeneration-decay",
    "effect:necrolyte_death_seeker:mobility:death-pulse-projectile",
    "effect:necrolyte_sadist:modifier:kill-stacking-regeneration",
    "effect:necrolyte_reapers_scythe:control:stun",
    "effect:necrolyte_reapers_scythe:modifier:missing-health-execution-and-kill-regeneration"
  ],
  "coverage": {
    "rawDefinitions": "known",
    "mechanics": "partial",
    "reviewedEffects": 11,
    "complete": false,
    "fields": {
      "primaryAttribute": {
        "state": "known"
      },
      "attackRange": {
        "state": "known"
      },
      "complexity": {
        "state": "known"
      },
      "roles": {
        "state": "known"
      }
    }
  }
}
