{
  "id": "91",
  "key": "wisp",
  "sourceKey": "npc_dota_hero_wisp",
  "name": "Io",
  "aliases": [
    "guardian",
    "io",
    "npc_dota_hero_wisp",
    "wisp"
  ],
  "primaryAttribute": 3,
  "attackRange": 500,
  "complexity": 3,
  "roles": [
    {
      "role": "support",
      "level": 3
    },
    {
      "role": "escape",
      "level": 2
    },
    {
      "role": "nuker",
      "level": 1
    }
  ],
  "enabled": true,
  "cmEnabled": true,
  "abilityIds": [
    "ability:91:wisp_tether",
    "ability:91:wisp_spirits",
    "ability:91:wisp_overcharge",
    "ability:91:wisp_spirits_in",
    "ability:91:wisp_spirits_out",
    "ability:91:wisp_relocate",
    "ability:91:wisp_tether_break",
    "ability:91:wisp_equilibrium",
    "ability:91:special_bonus_unique_wisp_overcharge_duration",
    "ability:91:special_bonus_strength_8",
    "ability:91:special_bonus_unique_wisp_3",
    "ability:91:special_bonus_unique_wisp",
    "ability:91:special_bonus_unique_wisp_10",
    "ability:91:special_bonus_unique_wisp_6",
    "ability:91:special_bonus_unique_wisp_relocate_delay",
    "ability:91:special_bonus_unique_wisp_4",
    "ability:91:special_bonus_attributes",
    "ability:91:wisp_essence_conduction"
  ],
  "effectIds": [
    "effect:wisp_tether:mobility:linked-friendly-speed",
    "effect:wisp_tether:mobility:distant-ally-latch",
    "effect:wisp_tether:heal:linked-health-restoration-transfer",
    "effect:wisp_tether:slow:enemy-crossing-tether-slow",
    "effect:wisp_tether:modifier:shard-contact-damage",
    "effect:wisp_tether:heal:shard-contact-damage-self-heal",
    "effect:wisp_spirits:damage:one-spirit-hero-explosion",
    "effect:wisp_spirits:modifier:scepter-continuous-spirit-spawn",
    "effect:wisp_spirits:slow:scepter-spirit-collision-slow",
    "effect:wisp_overcharge:modifier:self-overcharge-combat-bonuses",
    "effect:wisp_overcharge:heal:self-overcharge-regeneration",
    "effect:wisp_overcharge:modifier:tethered-overcharge-combat-bonuses",
    "effect:wisp_relocate:mobility:delayed-global-io-relocation",
    "effect:wisp_relocate:mobility:delayed-global-tethered-ally-relocation",
    "effect:wisp_equilibrium:passive:health-dependent-output-and-restoration-amplification"
  ],
  "coverage": {
    "rawDefinitions": "known",
    "mechanics": "partial",
    "reviewedEffects": 15,
    "complete": false,
    "fields": {
      "primaryAttribute": {
        "state": "known"
      },
      "attackRange": {
        "state": "known"
      },
      "complexity": {
        "state": "known"
      },
      "roles": {
        "state": "known"
      }
    }
  }
}
