{
  "id": "52",
  "key": "leshrac",
  "sourceKey": "npc_dota_hero_leshrac",
  "name": "Leshrac",
  "aliases": [
    "leshrac",
    "npc_dota_hero_leshrac",
    "soul",
    "tormented",
    "ts"
  ],
  "primaryAttribute": 2,
  "attackRange": 575,
  "complexity": 1,
  "roles": [
    {
      "role": "carry",
      "level": 1
    },
    {
      "role": "support",
      "level": 1
    },
    {
      "role": "nuker",
      "level": 3
    },
    {
      "role": "pusher",
      "level": 3
    },
    {
      "role": "disabler",
      "level": 1
    }
  ],
  "enabled": true,
  "cmEnabled": true,
  "abilityIds": [
    "ability:52:leshrac_split_earth",
    "ability:52:leshrac_diabolic_edict",
    "ability:52:leshrac_lightning_storm",
    "ability:52:leshrac_greater_lightning_storm",
    "ability:52:leshrac_defilement",
    "ability:52:leshrac_pulse_nova",
    "ability:52:special_bonus_mp_regen_150",
    "ability:52:special_bonus_armor_4",
    "ability:52:special_bonus_unique_leshrac_6",
    "ability:52:special_bonus_unique_leshrac_4",
    "ability:52:special_bonus_unique_leshrac_7",
    "ability:52:special_bonus_unique_leshrac_3",
    "ability:52:special_bonus_unique_leshrac_1",
    "ability:52:special_bonus_unique_leshrac_pulse_nova_lightning",
    "ability:52:special_bonus_attributes",
    "ability:52:leshrac_chronoptic_nourishment"
  ],
  "effectIds": [
    "effect:leshrac_split_earth:control:delayed-earth-stun",
    "effect:leshrac_split_earth:damage:delayed-earth-damage",
    "effect:leshrac_split_earth:modifier:shard-repeated-expanding-earth",
    "effect:leshrac_diabolic_edict:damage:one-edict-explosion",
    "effect:leshrac_lightning_storm:damage:lightning-first-hit",
    "effect:leshrac_lightning_storm:slow:lightning-hit-slow",
    "effect:leshrac_greater_lightning_storm:control:scepter-enemy-ethereal-disarm",
    "effect:leshrac_greater_lightning_storm:slow:scepter-enemy-slow",
    "effect:leshrac_greater_lightning_storm:modifier:scepter-self-ethereal-speed-enemy-amplification",
    "effect:leshrac_defilement:modifier:intelligence-scaled-area",
    "effect:leshrac_pulse_nova:damage:sustained-pulse-damage"
  ],
  "coverage": {
    "rawDefinitions": "known",
    "mechanics": "partial",
    "reviewedEffects": 11,
    "complete": false,
    "fields": {
      "primaryAttribute": {
        "state": "known"
      },
      "attackRange": {
        "state": "known"
      },
      "complexity": {
        "state": "known"
      },
      "roles": {
        "state": "known"
      }
    }
  }
}
