{
  "id": "67",
  "key": "spectre",
  "sourceKey": "npc_dota_hero_spectre",
  "name": "Spectre",
  "aliases": [
    "mercurial",
    "npc_dota_hero_spectre",
    "spectre"
  ],
  "primaryAttribute": 1,
  "attackRange": 150,
  "complexity": 2,
  "roles": [
    {
      "role": "carry",
      "level": 3
    },
    {
      "role": "durable",
      "level": 1
    },
    {
      "role": "escape",
      "level": 1
    }
  ],
  "enabled": true,
  "cmEnabled": true,
  "abilityIds": [
    "ability:67:spectre_spectral_dagger",
    "ability:67:spectre_shadow_step",
    "ability:67:spectre_dispersion",
    "ability:67:spectre_reality",
    "ability:67:spectre_desolate",
    "ability:67:spectre_haunt",
    "ability:67:special_bonus_unique_spectre",
    "ability:67:special_bonus_unique_spectre_2",
    "ability:67:special_bonus_unique_spectre_shadow_step_duration",
    "ability:67:special_bonus_unique_spectre_6",
    "ability:67:special_bonus_hp_300",
    "ability:67:special_bonus_unique_spectre_3",
    "ability:67:special_bonus_unique_spectre_4",
    "ability:67:special_bonus_unique_spectre_5",
    "ability:67:special_bonus_attributes",
    "ability:67:spectre_spectral"
  ],
  "effectIds": [
    "effect:spectre_spectral_dagger:damage:dagger-path-damage",
    "effect:spectre_spectral_dagger:slow:dagger-path-movement-slow",
    "effect:spectre_spectral_dagger:mobility:shadow-path-free-movement",
    "effect:spectre_dispersion:save:distance-scaled-damage-dispersion",
    "effect:spectre_dispersion:modifier:same-type-nonrecursive-reflection",
    "effect:spectre_dispersion:modifier:shard-active-dispersion-increase",
    "effect:spectre_reality:mobility:existing-haunt-or-shadow-step-swap",
    "effect:spectre_desolate:damage:isolated-target-pure-attack-bonus",
    "effect:spectre_haunt:modifier:global-uncontrolled-haunt-illusions",
    "effect:spectre_haunt:control:scepter-first-reality-fear",
    "effect:spectre_haunt:slow:scepter-first-reality-slow",
    "effect:spectre_shadow_step:illusion:single-target-shadow-illusion",
    "effect:spectre_haunt:illusion:global-uncontrolled-haunt-illusions"
  ],
  "coverage": {
    "rawDefinitions": "known",
    "mechanics": "partial",
    "reviewedEffects": 13,
    "complete": false,
    "fields": {
      "primaryAttribute": {
        "state": "known"
      },
      "attackRange": {
        "state": "known"
      },
      "complexity": {
        "state": "known"
      },
      "roles": {
        "state": "known"
      }
    }
  }
}
