{
  "id": "104",
  "key": "legion_commander",
  "sourceKey": "npc_dota_hero_legion_commander",
  "name": "Legion Commander",
  "aliases": [
    "commander",
    "lc",
    "legion commander",
    "legion-commander",
    "legion_commander",
    "npc_dota_hero_legion_commander",
    "tresdin",
    "tresdin,legion,lc"
  ],
  "primaryAttribute": 0,
  "attackRange": 150,
  "complexity": 1,
  "roles": [
    {
      "role": "carry",
      "level": 1
    },
    {
      "role": "disabler",
      "level": 2
    },
    {
      "role": "initiator",
      "level": 1
    },
    {
      "role": "durable",
      "level": 1
    },
    {
      "role": "nuker",
      "level": 1
    }
  ],
  "enabled": true,
  "cmEnabled": true,
  "abilityIds": [
    "ability:104:legion_commander_overwhelming_odds",
    "ability:104:legion_commander_press_the_attack",
    "ability:104:legion_commander_moment_of_courage",
    "ability:104:legion_commander_outfight_them",
    "ability:104:generic_hidden",
    "ability:104:legion_commander_duel",
    "ability:104:special_bonus_unique_legion_commander_9",
    "ability:104:special_bonus_unique_legion_commander_outfight_them_armor",
    "ability:104:special_bonus_unique_legion_commander_6",
    "ability:104:special_bonus_unique_legion_commander_4",
    "ability:104:special_bonus_unique_legion_commander_duel_duration",
    "ability:104:special_bonus_unique_legion_commander_3",
    "ability:104:special_bonus_unique_legion_commander_7",
    "ability:104:special_bonus_unique_legion_commander_duel_refresh_on_victory",
    "ability:104:special_bonus_attributes",
    "ability:104:legion_commander_intimidate"
  ],
  "effectIds": [
    "effect:legion_commander_overwhelming_odds:damage:enemy-count-overwhelming-odds",
    "effect:legion_commander_overwhelming_odds:slow:overwhelming-impact-slow",
    "effect:legion_commander_overwhelming_odds:modifier:overwhelming-attack-speed",
    "effect:legion_commander_overwhelming_odds:save:shard-actual-hero-damage-barrier",
    "effect:legion_commander_press_the_attack:dispel:press-strong-allied-dispel",
    "effect:legion_commander_press_the_attack:heal:press-health-regeneration",
    "effect:legion_commander_press_the_attack:mobility:press-movement-speed",
    "effect:legion_commander_press_the_attack:modifier:scepter-press-area-and-self-application",
    "effect:legion_commander_moment_of_courage:heal:attack-count-counterstrike-lifesteal",
    "effect:legion_commander_moment_of_courage:modifier:attack-count-counterstrike",
    "effect:legion_commander_outfight_them:modifier:nearby-cast-independent-armor-stacks",
    "effect:legion_commander_duel:control:connected-duel-target-restrictions",
    "effect:legion_commander_duel:modifier:duel-victory-permanent-damage",
    "effect:legion_commander_duel:modifier:scepter-victory-press-the-attack"
  ],
  "coverage": {
    "rawDefinitions": "known",
    "mechanics": "partial",
    "reviewedEffects": 14,
    "complete": false,
    "fields": {
      "primaryAttribute": {
        "state": "known"
      },
      "attackRange": {
        "state": "known"
      },
      "complexity": {
        "state": "known"
      },
      "roles": {
        "state": "known"
      }
    }
  }
}
